<?xml version="1.0" encoding="utf-8"?>
<?xml-stylesheet type="text/xsl" href="timetable.xsl"?>

<timetable xsi:noNamespaceSchemaLocation="timetable.xsd" xmlns=""
           xmlns:xsi="http://www.w3.org/2001/XMLSchema-instance">
    <hours bgcolor="d5f9d2">
        <hour pdiff="8" diff="12">08:00</hour>
        <hour pdiff="7" diff="12">09:00</hour>
        <hour pdiff="7" diff="12">10:00</hour>
        <hour pdiff="7" diff="12">11:00</hour>
        <hour pdiff="7" diff="12">12:00</hour>
        <hour pdiff="7" diff="12">13:00</hour>
        <hour pdiff="7" diff="12">14:00</hour>
        <hour pdiff="7" diff="12">15:00</hour>
        <hour pdiff="7" diff="12">16:00</hour>
        <hour pdiff="7" diff="12">17:00</hour>
        <hour pdiff="7" diff="12">18:00</hour>
        <hour pdiff="6" diff="10">19:00</hour>

    </hours>
    <days>
        <day id="Po" rows="1">
            <row num="1">
                <cell pdiff="31" diff="48" >
                    <break/>
                </cell>
                <cell pdiff="6" diff="10">
                    <course>
                        <courseid>632905</courseid>
                        <code>PB138/5</code>
                        <name>Moderní značkovací jazyky</name>
                        <teacher id="60380">A. Rambousek</teacher>
                        <rooms>
                            <room id="4384">B130</room>
                        </rooms>
                    </course>
                </cell>
                <cell pdiff="40" diff="62">
                    <break/>
                </cell>
                <cell pdiff="14" diff="22">
                    <course>
                        <courseid>632862</courseid>
                        <code>MB104</code>
                        <name>Matematika IV</name>
                        <teacher id="7048">Panak</teacher>
                        <rooms>
                            <room id="534">D1</room>
                            <room id="533">D2</room>
                            <room id="2362">D3</room>
                        </rooms>
                    </course>
                </cell>
            </row>
        </day>
        <day id="Út" rows="2">
            <row num="1">
                <cell pdiff="14" diff="22">
                    <course color="ffdddd">
                        <courseid>632862</courseid>
                        <code>MB104</code>
                        <name>Matematika IV</name>
                        <teacher>Panak</teacher>
                        <rooms>
                            <room>D1</room>
                            <room>D2</room>
                        </rooms>
                    </course>
                </cell>
                <cell pdiff="16" diff="26">
                    <break/>
                </cell>
                <cell pdiff="14" diff="22">
                    <course>
                        <courseid>632905</courseid>
                        <code>PB138</code>
                        <name>Moderní značkovací jazyky</name>
                        <teacher>Pitner</teacher>
                        <rooms>
                            <room>D1</room>
                        </rooms>
                    </course>
                </cell>        
                <cell pdiff="16" diff="26">
                    <break/>
                </cell>
                <cell pdiff="14" diff="22">
                    <course>
                        <courseid>632850</courseid>
                        <code>IV111</code>
                        <name>Pravděpodobnost v informatice</name>
                        <teacher>Bouda</teacher>
                        <rooms>
                            <room id="773">B204</room>
                        </rooms>
                    </course>
                </cell>
                <cell pdiff="1" diff="2">
                    <break/>
                </cell>
                <cell pdiff="14" diff="22">
                    <course>
                        <courseid>632850</courseid>
                        <code>IV111/01</code>
                        <name>Pravděpodobnost v informatice</name>
                        <teacher id="3717">J. Bouda</teacher>
                        <rooms>
                            <room>B410</room>
                        </rooms>
                    </course>
                </cell>
            </row>
            <row num="2">
                <cell pdiff="62" diff="96">
                    <break/>
                </cell>
                <cell pdiff="14" diff="22">
                    <course>
                        <courseid>632938</courseid>
                        <code>PV120</code>
                        <name>Informacni pravo</name>
                        <teacher id="1084">Smid</teacher>
                        <rooms>
                            <room id="2362">D3</room>
                        </rooms>
                    </course>
                </cell>
                <cell pdiff="15" diff="24">
                    <break/>
                </cell>
            </row>
        </day>
        <day id="Čt" rows="1">
            <row num="1">
                <cell pdiff="62" diff="96">
                    <break/>
                </cell>
                <cell pdiff="22" diff="34">
                    <course>
                        <courseid>632808</courseid>
                        <code>IA014</code>
                        <name>Funkcionální programování</name>
                        <teacher id="325">Škarvada</teacher>
                        <rooms>
                            <room id="773">B204</room>
                        </rooms>
                    </course>
                </cell>
                <cell pdiff="7" diff="12">
                    <break/>
                </cell>
            </row>
        </day>
    </days>
</timetable>
